{
  "schema_version": "1.1.0",
  "request_id": "complex-0001",
  "revision": 1,
  "plan_status": "ACTIVE",
  "active_step_index": 1,
  "active_step_id": "step_2",
  "step_states": [
    {
      "step_id": "step_1",
      "action": "ADJUST_SPEED",
      "status": "COMPLETED",
      "activation_frame_id": "carla_00944802",
      "terminal_frame_id": "carla_00944910",
      "speed_reference_kmh": 36.0,
      "resolved_target_speed_kmh": 31.0,
      "reason_codes": ["pedestrian_clear"]
    },
    {
      "step_id": "step_2",
      "action": "CHANGE_LANE",
      "status": "ACTIVE",
      "activation_frame_id": "carla_00944911",
      "terminal_frame_id": null,
      "speed_reference_kmh": null,
      "resolved_target_speed_kmh": null,
      "reason_codes": []
    },
    {
      "step_id": "step_3",
      "action": "OVERTAKE",
      "status": "PENDING",
      "activation_frame_id": null,
      "terminal_frame_id": null,
      "speed_reference_kmh": null,
      "resolved_target_speed_kmh": null,
      "reason_codes": []
    }
  ],
  "last_frame_id": "carla_00944911",
  "last_feedback_outcome": "COMPLETED",
  "reason_codes": []
}
